{
  "version": "1.0.0",
  "_notes": {
    "status_write_exemptions": "Step 16c writes milestones[].status='done' to Steps 09/14 on verified milestones. Without this exemption, file-level change detection triggers E550 requiring full downstream replay, creating an infinite cycle.",
    "downstream_consumers": "Records which steps actively consume each step's output. Read by 'specdev prompt-context'. NOT used by the forward-replay check (which uses positional ordering in 'steps')."
  },
  "policy": {
    "mode": "strict_waterfall",
    "allow_self_dependency": false,
    "allow_forward_dependency": false,
    "require_full_forward_replay_on_change": true,
    "status_write_exemptions": {
      "09": [
        "milestones[].status"
      ],
      "14": [
        "milestones[].status"
      ]
    }
  },
  "steps": [
    "00",
    "01",
    "02",
    "02a",
    "03",
    "04",
    "05",
    "06",
    "07",
    "08",
    "09",
    "10",
    "11",
    "12",
    "13",
    "13a",
    "14",
    "15",
    "16",
    "16a",
    "16b",
    "16c"
  ],
  "coverage_thresholds": {
    "fr_coverage": 80,
    "mode": "warn"
  },
  "downstream_consumers": {
    "00": [
      "01",
      "03",
      "04",
      "07",
      "09",
      "10",
      "13a",
      "14"
    ],
    "01": [
      "02",
      "03",
      "04",
      "09",
      "13",
      "13a",
      "14"
    ],
    "02": [
      "02a",
      "05",
      "09",
      "11",
      "13",
      "15"
    ],
    "02a": [
      "03",
      "04",
      "05",
      "06",
      "07",
      "08",
      "09",
      "10",
      "11",
      "12",
      "13",
      "13a",
      "14",
      "15",
      "16",
      "16a",
      "16b",
      "16c"
    ],
    "03": [
      "04",
      "05",
      "07"
    ],
    "04": [
      "05",
      "06",
      "07",
      "08",
      "09",
      "11",
      "13",
      "13a",
      "14",
      "15",
      "16",
      "16a",
      "16c"
    ],
    "05": [
      "06",
      "08",
      "09",
      "11",
      "13",
      "13a",
      "15",
      "16",
      "16a"
    ],
    "06": [
      "08",
      "11",
      "16a"
    ],
    "07": [
      "08",
      "09",
      "11",
      "13",
      "16a"
    ],
    "08": [
      "09",
      "13",
      "13a",
      "14",
      "15",
      "16",
      "16a",
      "16b",
      "16c"
    ],
    "09": [
      "10",
      "14",
      "16"
    ],
    "10": [
      "12"
    ],
    "11": [
      "13",
      "14",
      "15",
      "16",
      "16a",
      "16b",
      "16c"
    ],
    "12": [
      "13a",
      "14",
      "16",
      "16a",
      "16b",
      "16c"
    ],
    "13": [
      "13a",
      "14"
    ],
    "13a": [
      "14"
    ],
    "14": [
      "15",
      "16",
      "16a",
      "16b",
      "16c"
    ],
    "15": [
      "16",
      "16a",
      "16b"
    ],
    "16": [
      "16a",
      "16b",
      "16c"
    ],
    "16a": [
      "16b"
    ],
    "16b": [
      "16c"
    ],
    "16c": []
  }
}
